<?xml version="1.0" encoding="UTF-8"?>
<V1C6ND_okmanyiroda xmlns:xs="http://www.w3.org/2001/XMLSchema-instance" xs:noNamespaceSchemaLocation="XMLSchemaV1C6ND.xsd">

    <!-- DOLGOZOK -->

    <dolgozo did="1" fid="1">
        <szig>14725AE</szig>
        <nev>Toth Erzsebet</nev>
        <szulido>1985-07-11</szulido>
        <irsz>3300</irsz>
        <varos>Eger</varos>
        <utca>Szechenyi ut</utca>
        <hsz>2</hsz>
    </dolgozo>

    <dolgozo did="2" fid="2">
        <szig>65815FV</szig>
        <nev>Nagy Zsigmond</nev>
        <szulido>1970-01-05</szulido>
        <irsz>3500</irsz>
        <varos>Miskolc</varos>
        <utca>Kossuth utca</utca>
        <hsz>36A</hsz>
    </dolgozo>

    <dolgozo did="3" fid="2">
        <szig>148575UK</szig>
        <nev>Kovacs Levente</nev>
        <szulido>1995-12-08</szulido>
        <irsz>3434</irsz>
        <varos>Malyi</varos>
        <utca>Petofi ut</utca>
        <hsz>50</hsz>
    </dolgozo>

    <!-- tovabbi dolgozo elemek -->

    <!-- MUNKAKOROK -->

    <munkakorok mid="1">
        <megnevezes>NAV ugyintezo</megnevezes>
    </munkakorok>

    <munkakorok mid="2">
        <megnevezes>gepjarmu ugyintezo</megnevezes>
    </munkakorok>

    <munkakorok mid="3">
        <megnevezes>CSOK ugyintezo</megnevezes>
    </munkakorok>
  
    <munkakorok mid="4">
        <megnevezes>palyazati ugyintezo</megnevezes>
    </munkakorok>


    <!-- tovabbi munkakorok elemek -->

    <!-- SZEREP -->

    <szerep did="1" mid="2">
        <helyettesit-e>0</helyettesit-e>
    </szerep>

    <szerep did="1" mid="3">
        <helyettesit-e>0</helyettesit-e>
    </szerep>

    <szerep did="1" mid="4">
        <helyettesit-e>0</helyettesit-e>
    </szerep>

    <szerep did="2" mid="1">
        <helyettesit-e>1</helyettesit-e>
    </szerep>

    <szerep did="3" mid="4">
        <helyettesit-e>0</helyettesit-e>
    </szerep>
    
    <szerep did="3" mid="2">
        <helyettesit-e>0</helyettesit-e>
    </szerep>

    <!-- tovabbi szerep elemek -->

    <!-- MUNKAKOR ISMERETEK -->

    <munkakor_ism mid="1"> 
        <ismeretek>adobevallas kezelese</ismeretek>
        <ismeretek>adozasi ismeretek</ismeretek>
    </munkakor_ism>

    <munkakor_ism mid="2"> 
        <ismeretek>MS Office ismeretek</ismeretek>
        <ismeretek>forgalmi engedely kezelese</ismeretek>
        <ismeretek>adasveteli szerzodes kezelese</ismeretek>
        <ismeretek>torzskonyv kezelese</ismeretek>
    </munkakor_ism>

    <munkakor_ism mid="3"> 
        <ismeretek>MS Office ismeretek</ismeretek>
        <ismeretek>jogi ismeretek</ismeretek>
        <ismeretek>szamviteli ismeretek</ismeretek>
    </munkakor_ism>
        
    <munkakor_ism mid="4">
        <ismeretek>MS Office ismeretek</ismeretek>
        <ismeretek>jogi ismeretek</ismeretek>
    </munkakor_ism>

    <!-- tovabbi munkakor_ism elemek -->

    <!-- ABLAK -->

    <ablak aid="1" did="2">
        <ugykor>adobevallas</ugykor>
    </ablak>

    <ablak aid="2" did="4">
        <ugykor>szemelyig.</ugykor>
    </ablak>

    <ablak aid="3" did="3">
        <ugykor>szemelyes iratok</ugykor>
    </ablak>

    <!-- tovabbi ablak elemek -->

    <!-- UGYFEL -->

    <ugyfel uid="1" aid="3">
        <szig>577403KE</szig>
        <nev>Hegyi Karoly</nev>
        <szulido>1969-09-15</szulido>
        <irsz>3432</irsz>
        <varos>Emod</varos>
        <utca>Kossuth ut</utca>
        <hsz>15</hsz>
        <belepes>2022-11-18T08:06:00</belepes>
        <kilepes>2022-11-18T08:24:00</kilepes>
    </ugyfel>

    <ugyfel uid="2" aid="1">
        <szig>775491HB</szig>
        <nev>Kis Elek</nev>
        <szulido>1979-04-05</szulido>
        <irsz>3300</irsz>
        <varos>Eger</varos>
        <utca>Petofi ut</utca>
        <hsz>6B</hsz>
        <belepes>2022-11-18T08:10:00</belepes>
        <kilepes>2022-11-18T08:25:00</kilepes>
    </ugyfel>

    <ugyfel uid="3" aid="2">
        <szig>224546DF</szig>
        <nev>Toth Maria</nev>
        <szulido>1980-12-25</szulido>
        <irsz>3400</irsz>
        <varos>Mezokovesd</varos>
        <utca>Matyas kiraly ut</utca>
        <hsz>189</hsz>
        <belepes>2022-11-18T08:11:00</belepes>
        <kilepes>2022-11-18T08:29:00</kilepes>
    </ugyfel>

    <!-- tovabbi ugyfel elemek -->

    <!-- FELETTES -->
    <felettes fid="1">
        <szig>468534WW</szig>
        <nev>Piros Rozsa</nev>
    </felettes>

    <felettes fid="2">
        <szig>795341AC</szig>
        <nev>Szabo Tamas</nev>
    </felettes>

    <felettes fid="3">
        <szig>861888JB</szig>
        <nev>Lengyel Laszlo</nev>
    </felettes>

    <!-- tovabbi felettes elemek -->

</V1C6ND_okmanyiroda>
